{
  "$schema": "https://json-schema.org/draft/2020-12/schema",
  "$id": "urn:raticode:rattish:schema:diagnostic-1.json",
  "title": "Rattish diagnostic",
  "type": "object",
  "properties": {
    "$schema": {"type": "string"},
    "code": {"type": "string", "pattern": "^RATTISH_[A-Z0-9_]+$"},
    "severity": {"enum": ["error", "warning"]},
    "phase": {
      "enum": ["lexer", "parser", "semantic", "lowering", "preflight", "runtime", "export"]
    },
    "message": {"type": "string", "minLength": 1},
    "file": {"type": "string", "minLength": 1},
    "span": {"$ref": "#/$defs/span"},
    "related": {
      "type": "array",
      "items": {"$ref": "#/$defs/related"}
    },
    "details": {"type": "object"},
    "suggestions": {
      "type": "array",
      "items": {"type": "string", "minLength": 1}
    }
  },
  "required": [
    "$schema",
    "code",
    "severity",
    "phase",
    "message",
    "file",
    "span",
    "related",
    "details",
    "suggestions"
  ],
  "additionalProperties": false,
  "$defs": {
    "position": {
      "type": "object",
      "properties": {
        "offset": {"type": "integer", "minimum": 0},
        "line": {"type": "integer", "minimum": 1},
        "column": {"type": "integer", "minimum": 1}
      },
      "required": ["offset", "line", "column"],
      "additionalProperties": false
    },
    "span": {
      "type": "object",
      "properties": {
        "start": {"$ref": "#/$defs/position"},
        "end": {"$ref": "#/$defs/position"}
      },
      "required": ["start", "end"],
      "additionalProperties": false
    },
    "related": {
      "type": "object",
      "properties": {
        "file": {"type": "string", "minLength": 1},
        "span": {"$ref": "#/$defs/span"},
        "message": {"type": "string", "minLength": 1}
      },
      "required": ["file", "span", "message"],
      "additionalProperties": false
    }
  }
}
